{
  "$schema":"https://json-schema.org/draft/2020-12/schema","$id":"https://cacanode.local/contracts/ai-interview/v1/resume-analysis-request-v1.2.schema.json","type":"object","additionalProperties":false,
  "required":["schema_version","event_id","event_type","occurred_at","tenant_id","aggregate_id","analysis_id","application_id","document_id","storage_key","file_name","content_type","file_size_bytes","requested_language_tag","cv_sha256","analysis_mode","policy_version","model_version","analysis_revision","job_title","job_description","job_context_anchors","job_context_truncated","allowed_core_section_ids","template_questions","personalized_question_limit"],
  "properties":{"schema_version":{"const":"1.2"},"event_id":{"type":"string","format":"uuid"},"event_type":{"const":"interview.resume-analysis.requested"},"occurred_at":{"type":"string","format":"date-time"},"tenant_id":{"type":"string","format":"uuid"},"aggregate_id":{"type":"string","format":"uuid"},"analysis_id":{"type":"string","format":"uuid"},"application_id":{"type":"string","format":"uuid"},"document_id":{"type":"string","format":"uuid"},"storage_key":{"type":"string","minLength":1,"maxLength":512},"file_name":{"type":"string","minLength":1,"maxLength":255},"content_type":{"enum":["application/pdf","application/vnd.openxmlformats-officedocument.wordprocessingml.document"]},"file_size_bytes":{"type":"integer","minimum":1,"maximum":5242880},"requested_language_tag":{"enum":["vi-VN","en-US"]},"cv_sha256":{"type":"string","pattern":"^[a-f0-9]{64}$"},"analysis_mode":{"enum":["SUMMARY_ONLY","PERSONALIZED_QUESTIONS"]},"policy_version":{"type":"string","minLength":1,"maxLength":80},"model_version":{"type":"string","minLength":1,"maxLength":120},"analysis_revision":{"type":"integer","minimum":1},"job_title":{"type":"string","minLength":1,"maxLength":200},"job_description":{"type":"string","maxLength":4000},"job_context_anchors":{"type":"array","minItems":1,"maxItems":250,"items":{"type":"object","additionalProperties":false,"required":["anchor_id","field","excerpt"],"properties":{"anchor_id":{"type":"string","minLength":1,"maxLength":160},"field":{"type":"string","minLength":1,"maxLength":80},"excerpt":{"type":"string","minLength":1,"maxLength":12000}}}},"job_context_truncated":{"type":"boolean"},"allowed_core_section_ids":{"type":"array","minItems":1,"maxItems":10,"uniqueItems":true,"items":{"type":"string","format":"uuid"}},"template_questions":{"type":"array","maxItems":100,"items":{"type":"object","additionalProperties":false,"required":["question_id","section_id","prompt","competency"],"properties":{"question_id":{"type":"string","format":"uuid"},"section_id":{"type":"string","format":"uuid"},"prompt":{"type":"string","minLength":1,"maxLength":1000},"competency":{"type":"string","minLength":1,"maxLength":200}}}},"personalized_question_limit":{"enum":[0,2]}}
}
