{
  "schema_version":"1.2","event_id":"b172cb1a-ca67-5938-8eae-0be043fb04c4","event_type":"interview.resume-analysis.requested","occurred_at":"2026-07-27T08:00:00Z",
  "tenant_id":"11111111-1111-4111-8111-111111111111","aggregate_id":"1a1bb079-8436-5e67-a172-6f8180dbadf5","analysis_id":"1a1bb079-8436-5e67-a172-6f8180dbadf5","application_id":"22222222-2222-4222-8222-222222222222",
  "document_id":"33333333-3333-4333-8333-333333333333","storage_key":"recruitment/11111111-1111-4111-8111-111111111111/applications/22222222-2222-4222-8222-222222222222/cv/33333333-3333-4333-8333-333333333333","file_name":"cv.pdf","content_type":"application/pdf","file_size_bytes":1024,"requested_language_tag":"en-US",
  "cv_sha256":"aaaaaaaaaaaaaaaaaaaaaaaaaaaaaaaaaaaaaaaaaaaaaaaaaaaaaaaaaaaaaaaa","analysis_mode":"PERSONALIZED_QUESTIONS","policy_version":"cv-redaction-fit-v2","model_version":"resume-analysis-v2","analysis_revision":2,
  "job_title":"Backend Engineer","job_description":"Build reliable Java services.","job_context_anchors":[
    {"anchor_id":"job:title","field":"title","excerpt":"Backend Engineer"},{"anchor_id":"job:description","field":"description","excerpt":"Build reliable Java services."},{"anchor_id":"job:department","field":"department","excerpt":"Engineering"},{"anchor_id":"job:location","field":"location","excerpt":"Ho Chi Minh City"},{"anchor_id":"job:employment_type","field":"employment_type","excerpt":"FULL_TIME"},{"anchor_id":"job:work_mode","field":"work_mode","excerpt":"HYBRID"},{"anchor_id":"job:experience_level","field":"experience_level","excerpt":"MID"},{"anchor_id":"job:language","field":"language","excerpt":"en-US"}
  ],"job_context_truncated":false,
  "allowed_core_section_ids":["55555555-5555-4555-8555-555555555555"],"template_questions":[],"personalized_question_limit":2
}
